{
 "version": 1,
 "units": "mm",
 "parameters": {
  "pocket_offset": 1.0,
  "pair_clearance": null,
  "wall_clearance": null,
  "resolution": 0.25,
  "inset": 2.6,
  "max_grid": 7,
  "rotation": "90"
 },
 "contours": {
  "0": [
   [
    73.9263,
    7.3636
   ],
   [
    73.5991,
    5.8011
   ],
   [
    72.8437,
    4.6437
   ],
   [
    71.8912,
    3.9517
   ],
   [
    69.7426,
    3.4888
   ],
   [
    56.5369,
    5.1808
   ],
   [
    40.1113,
    6.0274
   ],
   [
    29.8411,
    6.0955
   ],
   [
    24.8057,
    5.2945
   ],
   [
    21.7824,
    4.0609
   ],
   [
    19.7272,
    2.6136
   ],
   [
    16.305,
    1.03
   ],
   [
    11.3338,
    0.0
   ],
   [
    6.4689,
    0.6198
   ],
   [
    3.254,
    2.2609
   ],
   [
    1.2508,
    3.973
   ],
   [
    0.4305,
    5.3065
   ],
   [
    0.0,
    6.8404
   ],
   [
    0.1561,
    8.1101
   ],
   [
    1.0217,
    9.8605
   ],
   [
    1.8396,
    10.8612
   ],
   [
    3.2633,
    11.8978
   ],
   [
    6.1576,
    13.5163
   ],
   [
    10.7282,
    14.1974
   ],
   [
    16.2472,
    13.1598
   ],
   [
    18.0693,
    12.1371
   ],
   [
    19.9153,
    11.4895
   ],
   [
    21.4977,
    10.2563
   ],
   [
    25.0305,
    8.8204
   ],
   [
    29.5191,
    8.1507
   ],
   [
    31.0378,
    8.2776
   ],
   [
    31.8557,
    8.0736
   ],
   [
    33.0784,
    8.2951
   ],
   [
    36.2383,
    8.0889
   ],
   [
    47.905,
    8.5334
   ],
   [
    50.2677,
    8.8315
   ],
   [
    51.9241,
    8.7234
   ],
   [
    66.0827,
    10.1375
   ],
   [
    69.7574,
    10.803
   ],
   [
    72.1401,
    10.1952
   ],
   [
    72.7895,
    9.7003
   ],
   [
    73.6169,
    8.4396
   ]
  ],
  "1": [
   [
    162.7619,
    17.6114
   ],
   [
    161.6471,
    12.8943
   ],
   [
    159.6959,
    10.8398
   ],
   [
    157.1599,
    9.556
   ],
   [
    150.0355,
    9.4596
   ],
   [
    136.8452,
    11.7226
   ],
   [
    118.1393,
    13.9168
   ],
   [
    102.746,
    15.036
   ],
   [
    84.8557,
    15.5492
   ],
   [
    65.4347,
    14.6774
   ],
   [
    55.9374,
    12.0931
   ],
   [
    45.6544,
    5.3239
   ],
   [
    39.6216,
    2.3424
   ],
   [
    32.3456,
    0.6753
   ],
   [
    24.5717,
    0.0
   ],
   [
    17.8836,
    0.42
   ],
   [
    13.9953,
    1.3592
   ],
   [
    9.2337,
    3.3749
   ],
   [
    5.3929,
    6.0393
   ],
   [
    0.8216,
    12.3282
   ],
   [
    0.0,
    18.2084
   ],
   [
    0.7958,
    22.6908
   ],
   [
    3.5397,
    26.8929
   ],
   [
    5.3994,
    28.9429
   ],
   [
    9.2319,
    31.6131
   ],
   [
    17.2076,
    34.3921
   ],
   [
    26.2552,
    34.8878
   ],
   [
    36.3858,
    33.4741
   ],
   [
    39.5992,
    32.4812
   ],
   [
    45.8464,
    29.3724
   ],
   [
    56.0691,
    22.6156
   ],
   [
    65.4275,
    20.0171
   ],
   [
    85.102,
    19.0785
   ],
   [
    102.1111,
    19.4953
   ],
   [
    134.6389,
    22.4079
   ],
   [
    153.1161,
    25.1226
   ],
   [
    157.1985,
    24.7805
   ],
   [
    159.3698,
    23.8142
   ],
   [
    161.6556,
    21.4876
   ]
  ],
  "2": [
   [
    141.1355,
    7.1262
   ],
   [
    140.1484,
    4.3884
   ],
   [
    137.1218,
    1.3774
   ],
   [
    134.4361,
    0.9057
   ],
   [
    100.4416,
    5.31
   ],
   [
    94.3825,
    5.2451
   ],
   [
    87.4905,
    6.157
   ],
   [
    82.1435,
    5.7461
   ],
   [
    75.517,
    6.3858
   ],
   [
    71.8353,
    5.8522
   ],
   [
    68.4977,
    6.481
   ],
   [
    66.652,
    5.9484
   ],
   [
    59.2638,
    6.1053
   ],
   [
    53.8135,
    5.4845
   ],
   [
    37.332,
    0.9051
   ],
   [
    28.5598,
    0.0
   ],
   [
    18.873,
    0.0088
   ],
   [
    10.2754,
    1.055
   ],
   [
    3.3651,
    1.2128
   ],
   [
    0.9652,
    1.9154
   ],
   [
    0.0083,
    3.5196
   ],
   [
    1.4343,
    5.7174
   ],
   [
    0.3017,
    8.1114
   ],
   [
    1.3915,
    11.0499
   ],
   [
    0.0,
    13.2585
   ],
   [
    0.9582,
    14.9256
   ],
   [
    3.2793,
    15.6062
   ],
   [
    10.3125,
    15.735
   ],
   [
    18.8665,
    16.7541
   ],
   [
    27.8729,
    16.7859
   ],
   [
    37.4809,
    15.805
   ],
   [
    47.67,
    12.7479
   ],
   [
    56.2245,
    10.8749
   ],
   [
    66.9092,
    10.7828
   ],
   [
    68.659,
    10.2646
   ],
   [
    71.7446,
    10.8971
   ],
   [
    75.6284,
    10.3307
   ],
   [
    82.1639,
    11.0027
   ],
   [
    83.2325,
    10.521
   ],
   [
    87.6006,
    10.5608
   ],
   [
    94.3256,
    11.4311
   ],
   [
    100.5963,
    11.3857
   ],
   [
    134.3407,
    15.7299
   ],
   [
    137.1039,
    15.2737
   ],
   [
    139.9615,
    12.5879
   ],
   [
    141.1148,
    9.8017
   ]
  ],
  "3": [
   [
    180.6694,
    12.0949
   ],
   [
    179.9802,
    8.3409
   ],
   [
    177.7066,
    4.9253
   ],
   [
    175.0234,
    3.5549
   ],
   [
    171.8336,
    3.2516
   ],
   [
    156.555,
    4.3579
   ],
   [
    147.5809,
    5.9963
   ],
   [
    136.8532,
    6.846
   ],
   [
    135.9605,
    7.5443
   ],
   [
    122.9812,
    8.897
   ],
   [
    81.384,
    9.8531
   ],
   [
    68.3685,
    7.8966
   ],
   [
    60.0741,
    4.254
   ],
   [
    57.8484,
    2.3512
   ],
   [
    53.4404,
    0.5745
   ],
   [
    49.0586,
    0.0
   ],
   [
    36.0336,
    0.1525
   ],
   [
    2.2559,
    3.6397
   ],
   [
    0.0502,
    6.0177
   ],
   [
    0.9414,
    9.1497
   ],
   [
    1.045,
    14.1769
   ],
   [
    0.0,
    18.1796
   ],
   [
    2.5319,
    20.6745
   ],
   [
    34.1976,
    24.0112
   ],
   [
    49.1158,
    24.2744
   ],
   [
    54.5966,
    23.3232
   ],
   [
    64.7311,
    17.7546
   ],
   [
    72.1487,
    15.4798
   ],
   [
    81.3321,
    14.5177
   ],
   [
    98.8483,
    14.6438
   ],
   [
    131.8395,
    16.375
   ],
   [
    135.9374,
    16.9595
   ],
   [
    136.8611,
    17.6917
   ],
   [
    170.944,
    21.4392
   ],
   [
    174.9527,
    21.0468
   ],
   [
    177.6523,
    19.7038
   ],
   [
    180.1443,
    15.8016
   ]
  ],
  "4": [
   [
    147.2672,
    10.58627288903725
   ],
   [
    146.60918108337347,
    6.482928308303104
   ],
   [
    144.9192604471108,
    4.30643879882925
   ],
   [
    142.74110406221484,
    2.6775310946832045
   ],
   [
    140.1174421478393,
    2.318782462172586
   ],
   [
    121.97495838705083,
    5.179458186565836
   ],
   [
    104.11851574036163,
    7.2967339310453125
   ],
   [
    92.42440569579283,
    8.005367652155416
   ],
   [
    72.81988698144791,
    8.15946102450897
   ],
   [
    62.395248091673686,
    7.240986208595289
   ],
   [
    46.64541847843057,
    7.266544965067392
   ],
   [
    35.68137341039881,
    5.762705834258444
   ],
   [
    32.725103703465486,
    4.806078092016839
   ],
   [
    29.412598906324703,
    4.800839340690259
   ],
   [
    25.073325307514207,
    3.205586645066487
   ],
   [
    21.846466157061002,
    2.8855201056844564
   ],
   [
    18.042550610482966,
    1.568000605389541
   ],
   [
    9.880787710391102,
    0.0
   ],
   [
    5.6167880889751585,
    1.2922517855631772
   ],
   [
    3.9283491197543374,
    2.427393948009011
   ],
   [
    0.4117182292571528,
    7.492472730611177
   ],
   [
    0.0,
    10.923008182640219
   ],
   [
    0.7706785284880371,
    15.107024242135696
   ],
   [
    2.0404407250229655,
    17.300182505830485
   ],
   [
    6.2024434456107915,
    21.175826612238623
   ],
   [
    14.484803459574133,
    24.803556072535354
   ],
   [
    27.386525059939782,
    26.090357440051687
   ],
   [
    44.511315229689956,
    25.162384080066076
   ],
   [
    48.89869009068087,
    24.071930053936374
   ],
   [
    60.0163522809456,
    22.88567037854633
   ],
   [
    64.50471862584337,
    21.685281949578542
   ],
   [
    68.27585228912022,
    18.87442727946787
   ],
   [
    72.01856969520139,
    17.304918548696435
   ],
   [
    83.23590045237131,
    15.80044441772669
   ],
   [
    111.86779311933537,
    15.312605544193923
   ],
   [
    121.06177523914378,
    16.102969077666685
   ],
   [
    122.60360854624047,
    15.802931501689814
   ],
   [
    136.52847415569127,
    17.34389168356539
   ],
   [
    141.09708864590985,
    17.172044765049534
   ],
   [
    145.1363775854235,
    15.064637981402454
   ],
   [
    146.76017882994313,
    12.584750686767507
   ]
  ],
  "5": [
   [
    211.99257354167085,
    15.054365966212035
   ],
   [
    211.10457909796418,
    11.41399091361803
   ],
   [
    209.26151834609703,
    8.799511116380776
   ],
   [
    206.15774466746214,
    6.689009573232224
   ],
   [
    198.95713684133938,
    6.294119010324101
   ],
   [
    188.3881191281926,
    8.1406458033129
   ],
   [
    148.41736249645547,
    11.71125024187751
   ],
   [
    105.3488646851349,
    13.064170445813447
   ],
   [
    58.67655723213752,
    12.820674442433653
   ],
   [
    54.54059121580267,
    12.255339322992594
   ],
   [
    48.04750557009706,
    9.803948666778162
   ],
   [
    36.232882636140346,
    2.646176875586597
   ],
   [
    29.32657080540967,
    0.6052607381632287
   ],
   [
    21.57827556540428,
    0.0
   ],
   [
    13.813629077969928,
    1.0453950439573059
   ],
   [
    9.76733033920263,
    2.442738782574835
   ],
   [
    1.4181929020059112,
    9.770082005436628
   ],
   [
    0.2487347525560637,
    12.642980303707292
   ],
   [
    0.0,
    16.248059945184416
   ],
   [
    2.2056986115132697,
    21.840927399105382
   ],
   [
    9.774394713091839,
    28.01503142830042
   ],
   [
    17.18780688075364,
    30.06518152260519
   ],
   [
    23.900337908620724,
    30.457532085912696
   ],
   [
    28.557771134627675,
    29.999485491268448
   ],
   [
    36.23671909387044,
    27.824928333191888
   ],
   [
    48.43276530118618,
    20.544151769674702
   ],
   [
    54.56985412786809,
    18.24389108969687
   ],
   [
    58.71968430868963,
    17.674269720929768
   ],
   [
    91.6920276658446,
    17.449850172883764
   ],
   [